{"canonicalChecksum":"97ac9330c3547a60cf28dea8096089106ead999c893a256b71179e3c041c7742","estimatedRasterWorkUnits":585,"featureId":"terminal-moraine","flowAzimuthDegrees":135,"geometryChecksum":"830af55d872e2346f1764d858f512047862d772a5e4477b9770a80b696244ba5","glacialParentCanonicalChecksum":"fbad51fae064b061c9a1e849618edab801595abe52be416c359cd761bb9ab495","glacialParentFeatureId":"valley-ice","glacialParentRelationId":"moraine-originates-at-ice","length":64,"maxY":256,"minY":0,"planVersion":1,"provenanceFieldId":"foundation.moraine-field.provenance","ridgeMaskFieldId":"foundation.moraine-field.ridge-mask","rings":[{"vertices":[{"xMillionths":42840000,"zMillionths":45360000},{"xMillionths":57960000,"zMillionths":45360000},{"xMillionths":57960000,"zMillionths":57960000},{"xMillionths":42840000,"zMillionths":57960000},{"xMillionths":42840000,"zMillionths":45360000}]}],"sedimentOwnershipFieldId":"foundation.moraine-field.sediment-ownership","selectedRidgeCount":3,"selectedRidgeHalfWidthBlocks":4,"selectedSedimentThicknessBlocks":3,"supportRadiusXZ":4,"width":64}